,Genre,Plot,Title
0,"Crime, Drama","Chronicles the experiences of a formerly successful banker as a prisoner in the gloomy jailhouse of Shawshank after being found guilty of a crime he claims he did not commit. The film portrays the man's unique way of dealing with his new, torturous life; along the way he befriends a number of fellow prisoners, most notably a wise long-term inmate named Red.                ",The Shawshank Redemption
1,"Crime, Drama","When the aging head of a famous crime family decides to transfer his position to one of his subalterns, a series of unfortunate events start happening to the family, and a war begins between all the well-known families leading to insolence, deportation, murder and revenge, and ends with the favorable successor being finally chosen.                ",The Godfather
2,"Crime, Drama","The continuing saga of the Corleone crime family tells the story of a young Vito Corleone growing up in Sicily and in 1910s New York; and follows Michael Corleone in the 1950s as he attempts to expand the family business into Las Vegas, Hollywood and Cuba.                ",The Godfather: Part II
3,"Action, Crime, Drama","Batman raises the stakes in his war on crime. With the help of Lieutenant Jim Gordon and District Attorney Harvey Dent, Batman sets out to dismantle the remaining criminal organizations that plague the city streets. The partnership proves to be effective, but they soon find themselves prey to a reign of chaos unleashed by a rising criminal mastermind known to the terrified citizens of Gotham as The Joker.                ",The Dark Knight
4,"Crime, Drama","The defense and the prosecution have rested and the jury is filing into the jury room to decide if a young man is guilty or innocent of murdering his father. What begins as an open-and shut-case of murder soon becomes a detective story that presents a succession of clues creating doubt, and a mini-drama of each of the jurors' prejudices and preconceptions about the trial, the accused, and each other. Based on the play, all of the action takes place on the stage of the jury room.                ",12 Angry Men
5,"Crime, Drama","Jules Winnfield and Vincent Vega are two hitmen who are out to retrieve a suitcase stolen from their employer, mob boss Marsellus Wallace. Wallace has also asked Vincent to take his wife Mia out a few days later when Wallace himself will be out of town. Butch Coolidge is an aging boxer who is paid by Wallace to lose his next fight. The lives of these seemingly unrelated people are woven together comprising of a series of funny, bizarre and uncalled-for incidents.                ",Pulp Fiction
6,"Biography, Drama, History","Oskar Schindler is a vainglorious and greedy German businessman who becomes an unlikely humanitarian amid the barbaric Nazi reign when he feels compelled to turn his factory into a refuge for Jews. Based on the true story of Oskar Schindler who managed to save about 1100 Jews from being gassed at the Auschwitz concentration camp, it is a testament for the good in all of us.                ",Schindler's List
7,"Adventure, Drama, Fantasy","While Frodo & Sam continue to approach Mount Doom to destroy the One Ring, unaware of the path Gollum is leading them, the former Fellowship aid Rohan & Gondor in a great battle in the Pelennor Fields, Minas Tirith and the Black Gates as Sauron wages his last war against Middle-earth.                ",The Lord of the Rings: The Return of the King
8,Western,"Blondie (The Good) is a professional gunslinger who is out trying to earn a few dollars. Angel Eyes (The Bad) is a hit man who always commits to a task and sees it through, as long as he is paid to do so. And Tuco (The Ugly) is a wanted outlaw trying to take care of his own hide. Tuco and Blondie share a partnership together making money off Tuco's bounty, but when Blondie unties the partnership, Tuco tries to hunt down Blondie. When Blondie and Tuco come across a horse carriage loaded with dead bodies, they soon learn from the only survivor (Bill Carson) that he and a few other men have buried a stash of gold in a cemetery. Unfortunately Carson dies and Tuco only finds out the name of the cemetery, while Blondie finds out the name on the grave. Now the two must keep each other alive in order to find the gold. Angel Eyes (who had been looking for Bill Carson) discovers that Tuco and Blondie meet with Carson and knows they know the location of the gold. All he needs is for the two to ...                ","The Good, the Bad and the Ugly"
9,Drama,"A ticking-time-bomb insomniac and a slippery soap salesman channel primal male aggression into a shocking new form of therapy. Their concept catches on, with underground ""fight clubs"" forming in every town, until an eccentric gets in the way and ignites an out-of-control spiral toward oblivion.                ",Fight Club
10,"Adventure, Drama, Fantasy","An ancient Ring thought lost for centuries has been found, and through a strange twist in fate has been given to a small Hobbit named Frodo. When Gandalf discovers the Ring is in fact the One Ring of the Dark Lord Sauron, Frodo must make an epic quest to the Cracks of Doom in order to destroy it! However he does not go alone. He is joined by Gandalf, Legolas the elf, Gimli the Dwarf, Aragorn, Boromir and his three Hobbit friends Merry, Pippin and Samwise. Through mountains, snow, darkness, forests, rivers and plains, facing evil and danger at every corner the Fellowship of the Ring must go. Their quest to destroy the One Ring is the only hope for the end of the Dark Lords reign!                ",The Lord of the Rings: The Fellowship of the Ring
11,"Action, Mystery, Sci-Fi","Dom Cobb is a skilled thief, the absolute best in the dangerous art of extraction, stealing valuable secrets from deep within the subconscious during the dream state, when the mind is at its most vulnerable. Cobb's rare ability has made him a coveted player in this treacherous new world of corporate espionage, but it has also made him an international fugitive and cost him everything he has ever loved. Now Cobb is being offered a chance at redemption. One last job could give him his life back but only if he can accomplish the impossible-inception. Instead of the perfect heist, Cobb and his team of specialists have to pull off the reverse: their task is not to steal an idea but to plant one. If they succeed, it could be the perfect crime. But no amount of careful planning or expertise can prepare the team for the dangerous enemy that seems to predict their every move. An enemy that only Cobb could have seen coming.                ",Inception
12,"Action, Adventure, Fantasy","After the Rebel base on the icy planet Hoth is taken over by the empire, Han, Leia, Chewbacca, and C-3PO flee across the galaxy from the Empire. Luke travels to the forgotten planet of Dagobah to receive training from the Jedi master Yoda, while Vader endlessly pursues him.",Star Wars: Episode V - The Empire Strikes Back
13,"Drama, Romance","Forrest Gump is a simple man with a low I.Q. but good intentions. He is running through childhood with his best and only friend Jenny. His 'mama' teaches him the ways of life and leaves him to choose his destiny. Forrest joins the army for service in Vietnam, finding new friends called Dan and Bubba, he wins medals, creates a famous shrimp fishing fleet, inspires people to jog, starts a ping-pong craze, create the smiley, write bumper stickers and songs, donating to people and meeting the president several times. However, this is all irrelevant to Forrest who can only think of his childhood sweetheart Jenny Curran. Who has messed up her life. Although in the end all he wants to prove is that anyone can love anyone.                ",Forrest Gump
14,"Adventure, Drama, Fantasy","While Frodo and Sam, now accompanied by a new guide, continue their hopeless journey towards the land of shadow to destroy the One Ring, each member of the broken fellowship plays their part in the battle against the evil wizard Saruman and his armies of Isengard.",The Lord of the Rings: The Two Towers
15,Drama,"McMurphy has a criminal past and has once again gotten himself into trouble and is sentenced by the court. To escape labor duties in prison, McMurphy pleads insanity and is sent to a ward for the mentally unstable. Once here, McMurphy both endures and stands witness to the abuse and degradation of the oppressive Nurse Ratched, who gains superiority and power through the flaws of the other inmates. McMurphy and the other inmates band together to make a rebellious stance against the atrocious Nurse.                ",One Flew Over the Cuckoo's Nest
16,"Biography, Crime, Drama","Henry Hill is a small time gangster, who takes part in a robbery with Jimmy Conway and Tommy De Vito, two other gangsters who have set their sights a bit higher. His two partners kill off everyone else involved in the robbery, and slowly start to climb up through the hierarchy of the Mob. Henry, however, is badly affected by his partners' success, but will he stoop low enough to bring about the downfall of Jimmy and Tommy?                ",Goodfellas
17,Drama,"A veteran samurai, who has fallen on hard times, answers a village's request for protection from bandits. He gathers 6 other samurai to help him, and they teach the townspeople how to defend themselves, and they supply the samurai with three small meals a day. The film culminates in a giant battle when 40 bandits attack the village.                ",Seven Samurai
18,"Action, Sci-Fi","Thomas A. Anderson is a man living two lives. By day he is an average computer programmer and by night a hacker known as Neo. Neo has always questioned his reality, but the truth is far beyond his imagination. Neo finds himself targeted by the police when he is contacted by Morpheus, a legendary computer hacker branded a terrorist by the government. Morpheus awakens Neo to the real world, a ravaged wasteland where most of humanity have been captured by a race of machines that live off of the humans' body heat and electrochemical energy and who imprison their minds within an artificial reality known as the Matrix. As a rebel against the machines, Neo must return to the Matrix and confront the agents: super-powerful computer programs devoted to snuffing out Neo and the entire human rebellion.                ",The Matrix
19,"Action, Adventure, Fantasy",A young boy from Tatooine sets out on an adventure with an old Jedi named Obi-Wan Kenobi as his mentor to save Princess Leia from the ruthless Darth Vader and Destroy the Death Star built by the Empire which has the power to destroy the entire galaxy.                ,Star Wars: Episode IV - A New Hope
20,"Crime, Drama","Brazil, 1960's, City of God. The Tender Trio robs motels and gas trucks. Younger kids watch and learn well...too well. 1970's: Li'l Zé has prospered very well and owns the city. He causes violence and fear as he wipes out rival gangs without mercy. His best friend Bené is the only one to keep him on the good side of sanity. Rocket has watched these two gain power for years, and he wants no part of it. Yet he keeps getting swept up in the madness. All he wants to do is take pictures. 1980's: Things are out of control between the last two remaining gangs...will it ever end? Welcome to the City of God.                ",City of God
21,"Drama, Family, Fantasy","George Bailey has spent his entire life giving of himself to the people of Bedford Falls. He has always longed to travel but never had the opportunity in order to prevent rich skinflint Mr. Potter from taking over the entire town. All that prevents him from doing so is George's modest building and loan company, which was founded by his generous father. But on Christmas Eve, George's Uncle Billy loses the business's $8,000 while intending to deposit it in the bank. Potter finds the misplaced money and hides it from Billy. When the bank examiner discovers the shortage later that night, George realizes that he will be held responsible and sent to jail and the company will collapse, finally allowing Potter to take over the town. Thinking of his wife, their young children, and others he loves will be better off with him dead, he contemplates suicide. But the prayers of his loved ones result in a gentle angel named Clarence coming to earth to help George, with the promise of earning his ...                ",It's a Wonderful Life
22,"Crime, Drama, Mystery","A film about two homicide detectives' desperate hunt for a serial killer who justifies his crimes as absolution for the world's ignorance of the Seven Deadly Sins. The movie takes us from the tortured remains of one victim to the next as the sociopathic ""John Doe"" sermonizes to Detectives Sommerset and Mills -- one sin at a time. The sin of Gluttony comes first and the murderer's terrible capacity is graphically demonstrated in the dark and subdued tones characteristic of film noir. The seasoned and cultured but jaded Sommerset researches the Seven Deadly Sins in an effort to understand the killer's modus operandi while the bright but green and impulsive Detective Mills scoffs at his efforts to get inside the mind of a killer...                ",Se7en
23,"Adventure, Drama, Sci-Fi","In the near future, Earth has been devastated by drought and famine, causing a scarcity in food and extreme changes in climate. When humanity is facing extinction, a mysterious rip in the space-time continuum is discovered, giving mankind the opportunity to widen its lifespan. A group of explorers must travel beyond our solar system in search of a planet that can sustain life. The crew of the Endurance are required to think bigger and go further than any human in history as they embark on an interstellar voyage into the unknown. Coop, the pilot of the Endurance, must decide between seeing his children again and the future of the human race.                ",Interstellar
24,"Action, Adventure, History","When Sanga and her husband, part of a tribe living around the province of Mahismathi, save a drowning infant, little do they know the background of the infant or what the future holds for him. The kid grows up to as Shivudu, a free-spirit wanting to explore the mountains and in the process learns of his roots and then realizes the whole purpose of his life and ends up confronting the mighty Bhallala Deva!                ",Baahubali: The Beginning
25,"Crime, Drama, Thriller","Following a truck hijack in New York, five conmen are arrested and brought together for questioning. As none of them are guilty, they plan a revenge operation against the police. The operation goes well, but then the influence of a legendary mastermind criminal called Keyser Söze is felt. It becomes clear that each one of them has wronged Söze at some point and must pay back now. The payback job leaves 27 men dead in a boat explosion, but the real question arises now: Who actually is Keyser Söze?                ",The Usual Suspects
26,"Comedy, Drama, Romance","In 1930s Italy, a carefree Jewish book keeper named Guido starts a fairy tale life by courting and marrying a lovely woman from a nearby city. Guido and his wife have a son and live happily together until the occupation of Italy by German forces. In an attempt to hold his family together and help his son survive the horrors of a Jewish Concentration Camp, Guido imagines that the Holocaust is a game and that the grand prize for winning is a tank.                ",Life Is Beautiful
27,"Crime, Drama, Thriller","Young FBI agent Clarice Starling is assigned to help find a missing woman to save her from a psychopathic serial killer who skins his victims. Clarice attempts to gain a better insight into the twisted mind of the killer by talking to another psychopath Hannibal Lecter, who used to be a respected psychiatrist. FBI agent Jack Crawford believes that Lecter, who is also a very powerful and clever mind manipulator, has the answers to their questions and can help locate the killer. However, Clarice must first gain Lecter's confidence before the inmate will give away any information.                ",The Silence of the Lambs
28,"Crime, Drama, Thriller","After her father, mother and little brother are killed by her father's employers, the 12-year-old daughter of an abject drug dealer is forced to take refuge in the apartment of a professional hitman who by her request, teaches her the methods of his job so she can take her revenge on the corrupt DEA agent who ruined her life by killing her beloved brother.                ",Léon: The Professional
29,Western,"Story of a young woman, Mrs. McBain, who moves from New Orleans to frontier Utah, on the very edge of the American West. She arrives to find her new husband and family slaughtered, but by whom? The prime suspect, coffee-lover Cheyenne, befriends her and offers to go after the real killer, assassin gang leader Frank, in her honor. He is accompanied by Harmonica, a man already on a quest to get even.                ",Once Upon a Time in the West
30,"Comedy, Drama, Romance",A tramp falls in love with a beautiful blind girl. Her family is in financial trouble. The tramp's on-and-off friendship with a wealthy man allows him to be the girl's benefactor and suitor.                ,City Lights
31,"Animation, Adventure, Family","Chihiro and her parents are moving to a small Japanese town in the countryside. much to Chihiro's dismay. On the way to their new home, Chihiro's father makes a wrong turn and drives down a lonely one-lane road which dead-ends in front of a tunnel. Her parents decide to stop the car and explore the area. They go through the tunnel and find an abandoned amusement park on the other side, with its own little town. When her parents see a restaurant with great-smelling food but no staff, they decide to eat and pay later. However, Chihiro refuses to eat and decides to explore the theme park a bit more. She meets a boy named Haku who tells her that Chihiro and her parents are in danger, and they must leave immediately She runs to the restaurant and finds that her parents have turned into pigs. In addition, the theme park turns out to be a town inhabited by demons, spirits, and evil gods. At the center of the town is a bathhouse where these creatures go to relax. The owner of the bathhouse is...                ",Spirited Away
32,"Biography, Comedy, Drama","In Paris, the aristocratic and intellectual Philippe is a quadriplegic millionaire who is interviewing candidates for the position of his carer, with his red-haired secretary Magalie. Out of the blue, the rude African Driss cuts the line of candidates and brings a document from the Social Security and asks Phillipe to sign it to prove that he is seeking a job position so he can receive his unemployment benefit. Philippe challenges Driss, offering him a trial period of one month to gain experience helping him. Then Driss can decide whether he would like to stay with him or not. Driss accepts the challenge and moves to the mansion, changing the boring life of Phillipe and his employees.                ",The Intouchables
33,"Drama, Romance, War","In World War II Casablanca, Rick Blaine, exiled American and former freedom fighter, runs the most popular nightspot in town. The cynical lone wolf Blaine comes into the possession of two valuable letters of transit. When Nazi Major Strasser arrives in Casablanca, the sycophantic police Captain Renault does what he can to please him, including detaining a Czechoslovak underground leader Victor Laszlo. Much to Rick's surprise, Lazslo arrives with Ilsa, Rick's one time love. Rick is very bitter towards Ilsa, who ran out on him in Paris, but when he learns she had good reason to, they plan to run off together again using the letters of transit. Well, that was their original plan....                ",Casablanca
34,"Action, Drama, War","Opening with the Allied invasion of Normandy on 6 June 1944, members of the 2nd Ranger Battalion under Cpt. Miller fight ashore to secure a beachhead. Amidst the fighting, two brothers are killed in action. Earlier in New Guinea, a third brother is KIA. Their mother, Mrs. Ryan, is to receive all three of the grave telegrams on the same day. The United States Army Chief of Staff, George C. Marshall, is given an opportunity to alleviate some of her grief when he learns of a fourth brother, Private James Ryan, and decides to send out 8 men (Cpt. Miller and select members from 2nd Rangers) to find him and bring him back home to his mother...                ",Saving Private Ryan
35,"Crime, Drama","Derek Vineyard is paroled after serving 3 years in prison for killing two thugs who tried to break into/steal his truck. Through his brother, Danny Vineyard's narration, we learn that before going to prison, Derek was a skinhead and the leader of a violent white supremacist gang that committed acts of racial crime throughout L.A. and his actions greatly influenced Danny. Reformed and fresh out of prison, Derek severs contact with the gang and becomes determined to keep Danny from going down the same violent path as he did.                ",American History X
36,"Comedy, Drama","Chaplins last 'silent' film, filled with sound effects, was made when everyone else was making talkies. Charlie turns against modern society, the machine age, (The use of sound in films ?) and progress. Firstly we see him frantically trying to keep up with a production line, tightening bolts. He is selected for an experiment with an automatic feeding machine, but various mishaps leads his boss to believe he has gone mad, and Charlie is sent to a mental hospital... When he gets out, he is mistaken for a communist while waving a red flag, sent to jail, foils a jailbreak, and is let out again. We follow Charlie through many more escapades before the film is out.                ",Modern Times
37,"Action, Adventure","The year is 1936. An archeology professor named Indiana Jones is venturing in the jungles of South America searching for a golden statue. Unfortunately, he sets off a deadly trap but miraculously escapes. Then, Jones hears from a museum curator named Marcus Brody about a biblical artifact called The Ark of the Covenant, which can hold the key to humanly existence. Jones has to venture to vast places such as Nepal and Egypt to find this artifact. However, he will have to fight his enemy Rene Belloq and a band of Nazis in order to reach it.                ",Raiders of the Lost Ark
38,"Horror, Mystery, Thriller","Phoenix officeworker Marion Crane is fed up with the way life has treated her. She has to meet her lover Sam in lunch breaks and they cannot get married because Sam has to give most of his money away in alimony. One Friday Marion is trusted to bank $40,000 by her employer. Seeing the opportunity to take the money and start a new life, Marion leaves town and heads towards Sam's California store. Tired after the long drive and caught in a storm, she gets off the main highway and pulls into The Bates Motel. The motel is managed by a quiet young man called Norman who seems to be dominated by his mother.                ",Psycho
39,"Mystery, Thriller","Professional photographer L.B. ""Jeff"" Jeffries breaks his leg while getting an action shot at an auto race. Confined to his New York apartment, he spends his time looking out of the rear window observing the neighbors. He begins to suspect that a man across the courtyard may have murdered his wife. Jeff enlists the help of his high society fashion-consultant girlfriend Lisa Freemont and his visiting nurse Stella to investigate.                ",Rear Window
40,"Crime, Drama, Fantasy","Death Row guards at a penitentiary, in the 1930's, have a moral dilemma with their job when they discover one of their prisoners, a convicted murderer, has a special gift.                ",The Green Mile
41,"Drama, Music","A young and talented drummer attending a prestigious music academy finds himself under the wing of the most respected professor at the school, one who does not hold back on abuse towards his students. The two form an odd relationship as the student wants to achieve greatness, and the professor pushes him.                ",Whiplash
42,"Biography, Drama, War","A brilliant pianist, a Polish Jew, witnesses the restrictions Nazis place on Jews in the Polish capital, from restricted access to the building of the Warsaw ghetto. As his family is rounded up to be shipped off to the Nazi labor camps, he escapes deportation and eludes capture by living in the ruins of Warsaw.                ",The Pianist
43,"Action, Sci-Fi","Almost 10 years have passed since the first cyborg called The Terminator tried to kill Sarah Connor and her unborn son, John Connor. John Connor, the future leader of the human resistance, is now a healthy young boy. However another Terminator is sent back through time called the T-1000, which is more advanced and more powerful than its predecessor. The Mission: to kill John Connor when he's still a child. However, Sarah and John do not have to face this threat of a Terminator alone. Another Terminator is also sent back through time. The mission: to protect John and Sarah Connor at all costs. The battle for tomorrow has begun...                ",Terminator 2: Judgment Day
