,Genre,Plot,Title
463,"Drama, Family, Musical","Gloriously witty adaptation of the Broadway musical about Professor Henry Higgins, who takes a bet from Colonel Pickering that he can transform unrefined, dirty Cockney flower girl Eliza Doolittle into a lady, and fool everyone into thinking she really is one, too! He does, and thus young aristocrat Freddy Eynsford-Hill falls madly in love with her. But when Higgins takes all the credit and forgets to acknowledge her efforts, Eliza angrily leaves him for Freddy, and suddenly Higgins realizes he's grown accustomed to her face and can't really live without it.                ",My Fair Lady
464,"Action, Crime, Thriller","Two Irish brothers accidentally kill mafia thugs. They turn themselves in and are released as heroes. They then see it as a calling by God and start knocking off mafia gang members one by one. Willem Dafoe plays the detective trying to figure out the killings, but the closer he comes to catching the Irish brothers, the more he thinks the brothers are doing the right thing.                ",The Boondock Saints
465,"Crime, Drama","While waiting for her mothers reply to take her to the USA, Lilya idles the time away smoking, drinking and having fun with her, too, outcast friend Volodya. In time, the chance of a new life becomes non-existent; her life is going nowhere. Meeting a young man, she then finds a plane ticket in her hand and a new life in Sweden: a job, an apartment and prospects. All is not what it seems. There shall be work, there shall be housing and there shall be no escape. This is the stark, frank and disturbing vision of the life of a young victim of the underground sex trade and in all its tone of realism of abject poverty, despicable actions and of wanting to show that dreaming of a better life is not a crime but that life can shatter the illusion of a happy ending.                ",Lilya 4-Ever
466,"Drama, Fantasy, Music","Weronika lives in Poland. Véronique lives in Paris. They don't know each other. Weronika gets a place in a music school, works hard, but collapses and dies on her first performance. At this point, Véronique's life seems to take a turn and she decides not to be a singer...                ",The Double Life of Veronique
467,"Drama, Romance","In Paris, before WWI, two friends, Jules (Austrian) and Jim (French) fall in love with the same woman, Catherine. But Catherine loves and marries Jules. After the war, when they meet again in Germany, Catherine starts to love Jim... This is the story of three people in love, a love which does not affect their friendship, and about how their relationship evolves with the years.                ",Jules and Jim
468,"Animation, Adventure, Comedy","When a green ogre named Shrek discovers his swamp has been 'swamped' with all sorts of fairytale creatures by the scheming Lord Farquaad, Shrek sets out with a very loud donkey by his side to 'persuade' Farquaad to give Shrek his swamp back. Instead, a deal is made. Farquaad, who wants to become the King, sends Shrek to rescue Princess Fiona, who is awaiting her true love in a tower guarded by a fire-breathing dragon. But once they head back with Fiona, it starts to become apparent that not only does Shrek, an ugly ogre, begin to fall in love with the lovely princess, but Fiona is also hiding a huge secret.                ",Shrek
469,"Comedy, Drama, Family","At the Macy's Department Store Thanksgiving Day parade, the actor playing Santa is discovered to be drunk by a whiskered old man. Doris Walker, the no nonsense special events director, persuades the old man to take his place. The old man proves to be a sensation and is quickly recruited to be the store Santa at the main Macy's outlet. While he is successful, Ms. Walker learns that he calls himself Kris Kringle and he claims to be the actual Santa Claus. Despite reassurances by Kringle's doctor that he is harmless, Doris still has misgivings, especially when she has cynically trained herself, and especially her daughter, Susan, to reject all notions of belief and fantasy. And yet, people, especially Susan, begin to notice there is something special about Kris and his determination to advance the true spirit of Christmas amidst the rampant commercialism around him and succeeding in improbable ways. When a raucous conflict with the store's cruelly incompetent psychologist erupts, Kris ...                ",Miracle on 34th Street
470,"Drama, Mystery","Coming back to accomplish the divorce procedure, Ahmad an Iranian man, arrives in Paris after four years to meet his ex-wife and her daughters from her previous marriage. He notices his ex is in a relationship with an Arab named Samir who also has a son and a wife in a coma. The relationship of the older daughter and her mother is in deterioration because the daughter thinks her mother is the cause of Samir's wife comatose state. The affairs get more complicated when the older daughter discloses something heinous she has done.                ",The Past
471,"Adventure, Biography, Drama","To escape the edict of Egypt's Pharoah, Rameses I, condemning all newborn Hebrew males, the infant Moses is set adrift on the Nile in a reed basket. Saved by the pharaoh's daughter Bithiah, he is adopted by her and brought up in the court of her brother, Pharaoh Seti. Moses gains Seti's favor and the love of the throne princess Nefertiri, as well as the hatred of Seti's son, Rameses. When his Hebrew heritage is revealed, Moses is cast out of Egypt, and makes his way across the desert where he marries, has a son and is commanded by God to return to Egypt to free the Hebrews from slavery. In Egypt, Moses' fiercest enemy proves to be not Rameses, but someone near to him who can 'harden his heart'.                ",The Ten Commandments
472,"Action, Adventure, Fantasy","When his brother is killed in a robbery, paraplegic Marine Jake Sully decides to take his place in a mission on the distant world of Pandora. There he learns of greedy corporate figurehead Parker Selfridge's intentions of driving off the native humanoid ""Na'vi"" in order to mine for the precious material scattered throughout their rich woodland. In exchange for the spinal surgery that will fix his legs, Jake gathers intel for the cooperating military unit spearheaded by gung-ho Colonel Quaritch, while simultaneously attempting to infiltrate the Na'vi people with the use of an ""avatar"" identity. While Jake begins to bond with the native tribe and quickly falls in love with the beautiful alien Neytiri, the restless Colonel moves forward with his ruthless extermination tactics, forcing the soldier to take a stand - and fight back in an epic battle for the fate of Pandora.                ",Avatar
473,"Crime, Thriller","NIGHTCRAWLER is a thriller set in the nocturnal underbelly of contemporary Los Angeles. <a href=""/name/nm0350453?ref_=tt_stry_pl"">Jake Gyllenhaal</a> stars as Lou Bloom, a driven young man desperate for work who discovers the high-speed world of L.A. crime journalism. Finding a group of freelance camera crews who film crashes, fires, murder and other mayhem, Lou muscles into the cut-throat, dangerous realm of nightcrawling - where each police siren wail equals a possible windfall and victims are converted into dollars and cents. Aided by <a href=""/name/nm0000623?ref_=tt_stry_pl"">Rene Russo</a> as Nina, a veteran of the blood-sport that is local TV news, Lou blurs the line between observer and participant to become the star of his own story.                ",Nightcrawler
474,"Biography, Drama","Christy Brown is a spastic quadriplegic born to a large, poor Irish family. His mother, Mrs Brown, recognizes the intelligence and humanity in the lad everyone else regards as a vegetable. Eventually, Christy matures into a cantankerous writer who uses his only functional limb, his left foot, to write with.                ",My Left Foot
475,Drama,"Adult film director Jack Horner is always on the lookout for new talent and it's only by chance that he meets Eddie Adams who is working as a busboy in a restaurant. Eddie is young, good looking and plenty of libido to spare. Using the screen name Dirk Diggler, he quickly rises to the top of his industry winning awards year after year. Drugs and ego however come between Dirk and those around him and he soon finds that fame is fleeting.                ",Boogie Nights
476,"Animation, Action, Adventure","From Walt Disney Animation Studios, the team behind ""Frozen"" and ""Wreck-It Ralph,"" comes ""Big Hero 6,"" an action-packed comedy-adventure about the special bond that develops between Baymax, a plus-sized inflatable robot, and prodigy Hiro Hamada. When a devastating event befalls the city of San Fransokyo and catapults Hiro into the midst of danger, he turns to Baymax and his close friends adrenaline junkie Go Go Tomago, neatnik Wasabi, chemistry whiz Honey Lemon and fanboy Fred. Determined to uncover the mystery, Hiro transforms his friends into a band of high-tech heroes called ""Big Hero 6.""                ",Big Hero 6
477,Drama,"Over a thirty-six hour period in Los Angeles, a handful of disparate people's lives intertwine as they deal with the tense race relations that belie life in the city. Among the players are: the Caucasian district attorney, who uses race as a political card; his Caucasian wife, who, having recently been carjacked by two black men, believes that her stereotypical views of non-whites is justified and cannot be considered racism; the two black carjackers who use their race both to their advantage and as an excuse; partnered Caucasian police constables, one who is a racist and uses his authority to harass non-whites, and the other who hates his partner because of those racist views, but who may have the same underlying values in his subconscious; a black film director and his black wife, who believes her husband doesn't support their black background enough, especially in light of an incident with the racist white cop; partnered police detectives and sometimes lovers, one Hispanic female ...                ",Crash
478,"Crime, Drama, Thriller","A highly styled 'genre' film which can perhaps be seen as a pastiche of all gangster movies. Tom Reagan is the laconic anti-hero of this amoral tale which is also, paradoxically, a look at morals within the criminal underworld of the 1930s. Two rival gangs vie for control of a city where the police are pawns, and the periodic busts of illicit drinking establishments are no more than a way for one gang to get back at the other. Black humour and shocking violence compete for screen time as we question whether or not Tom, right-hand man of the Irish mob leader, really has a heart.                ",Miller's Crossing
479,Drama,"Nejat seems disapproving about his widower father Ali's choice of prostitute Yeter for a live-in girlfriend. But he grows fond of her when he discovers she sends money home to Turkey for her daughter's university studies. Yeter's sudden death distances father and son. Nejat travels to Istanbul to search for Yeter's daughter Ayten. Political activist Ayten has fled the Turkish police and is already in Germany. She is befriended by a young woman, Lotte, who invites rebellious Ayten to stay in her home, a gesture not particularly pleasing to her conservative mother Susanne. When Ayten is arrested and her asylum plea is denied, she is deported and imprisoned in Turkey. Lotte travels to Turkey,where she gets caught up in the seemingly hopeless situation of freeing Ayten.                ",The Edge of Heaven
480,"Biography, Drama, Sport","The Fighter is a drama about boxer ""Irish"" Micky Ward's unlikely road to the world light welterweight title. His Rocky-like rise was shepherded by half-brother Dicky, a boxer-turned-trainer on the verge of being KO'd by drugs and crime.                ",The Fighter
481,"Drama, Romance","Hazel and Augustus are two teenagers who share an acerbic wit, a disdain for the conventional, and a love that sweeps them on a journey. Their relationship is all the more miraculous, given that Hazel's other constant companion is an oxygen tank, Gus jokes about his prosthetic leg, and they meet and fall in love at a cancer support group.                ",The Fault in Our Stars
482,"Horror, Thriller","The year is 1963, the night: Halloween. Police are called to 43 Lampkin Ln. only to discover that 15 year old Judith Myers has been stabbed to death, by her 6 year-old brother, Michael. After being institutionalized for 15 years, Myers breaks out on the night before Halloween. No one knows, nor wants to find out, what will happen on October 31st 1978 besides Myers' psychiatrist, Dr. Loomis. He knows Michael is coming back to Haddonfield, but by the time the town realizes it, it'll be too late for many people.                ",Halloween
483,"Drama, Musical","Sally Bowles, an American singer in 1930s Berlin, falls in love with bi-sexual Brian. They are both then seduced by Max, a rich playboy. Sally becomes pregnant, and Brian offers to marry her... All the characters are linked by the Kit-Kat club, a nightspot where Sally sings.                ",Cabaret
484,"Animation, Adventure, Drama","This is the story of a young witch, named Kiki who is now thirteen years old. But she is still a little green and plenty headstrong, but also resourceful, imaginative, and determined. With her trusty wisp of a talking cat named Jiji by her side she's ready to take on the world, or at least the quaintly European seaside village she's chosen as her new home.                ",Kiki's Delivery Service
485,"Biography, Drama, Thriller","Captain Phillips is a multi-layered examination of the 2009 hijacking of the U.S. container ship Maersk Alabama by a crew of Somali pirates. It is - through director Paul Greengrass's distinctive lens - simultaneously a pulse-pounding thriller, and a complex portrait of the myriad effects of globalization. The film focuses on the relationship between the Alabama's commanding officer, Captain Richard Phillips (two time Academy Award®-winner Tom Hanks), and the Somali pirate captain, Muse (Barkhad Abdi), who takes him hostage. Phillips and Muse are set on an unstoppable collision course when Muse and his crew target Phillips' unarmed ship; in the ensuing standoff, 145 miles off the Somali coast, both men will find themselves at the mercy of forces beyond their control.                ",Captain Phillips
486,"Action, Crime, Thriller","An ex-special agent CHA Tae-shik's only connection to the rest of the world is a little girl, So-mi, who lives nearby. Her mother, Hyo-jeong smuggles drugs from a drug trafficking organization and entrusts Tae-shik with the product, without letting him know. The traffickers find out about her smuggling and kidnap both Hyo-jeong and So-mi. The gang promises to release them if Tae-shik makes a delivery for them, however it actually is a larger plot to eliminate a rival drug ring leader. When Hyo-jeon's disemboweled body is discovered, Tae-shik realizes that So-mi's life may also be in danger. Tae-shik becomes enraged at the prospect that So-mi may already be dead and prepares for a battle, putting his own life at risk.                ",The Man from Nowhere
487,"Action, Thriller","Seventeen year-old Kim is the pride and joy of her father Bryan Mills. Bryan is a retired agent who left the Central Intelligence Agency to be near Kim in California. Kim lives with her mother Lenore and her wealthy stepfather Stuart. Kim manages to convince her reluctant father to allow her to travel to Paris with her friend Amanda. When the girls arrive in Paris they share a cab with a stranger named Peter, and Amanda lets it slip that they are alone in Paris. Using this information an Albanian gang of human traffickers kidnaps the girls. Kim barely has time to call her father and give him information. Her father gets to speak briefly to one of the kidnappers and he promises to kill the kidnappers if they do not let his daughter go free. The kidnapper wishes him ""good luck,"" so Bryan Mills travels to Paris to search for his daughter and her friend.                ",Taken
488,"Action, Comedy","Top London cop, PC Nicholas Angel is good. Too good. And to stop the rest of his team looking bad, he is reassigned to the quiet town of Sandford. He is paired with Danny Butterman, who endlessly questions him on the action lifestyle. Everything seems quiet for Angel, until two actors are found decapitated. It is called an accident, but Angel isn't going to accept that, especially when more and more people turn up dead. Angel and Danny clash with everyone, whilst trying to uncover the truth behind the mystery of the apparent ""accidents"".                ",Hot Fuzz
489,"Biography, Drama, Sport","For 25 years in Invercargill at the south end of New Zealand, Burt Munro (1899-1978) has been working on increasing the speed of his motorcycle, a 1920 Indian. He dreams of taking it to the Bonneville Salt Flats to see how fast it will go. By the early 1960s, heart disease threatens his life, so he mortgages his house and takes a boat to Los Angeles, buys an old car, builds a makeshift trailer, gets the Indian through customs, and heads for Utah. Along the way, people he meets are charmed by his open, direct friendliness. If he makes it to Bonneville, will they let an old guy on the flats with makeshift tires, no brakes, and no chute? And will the Indian actually respond?                ",The World's Fastest Indian
490,"Animation, Adventure, Comedy",A high-school girl acquires the ability to time travel.,The Girl Who Leapt Through Time
491,"Sci-Fi, Thriller","Dr. Ryan Stone (<a href=""/name/nm0000113?ref_=tt_stry_pl"">Sandra Bullock</a>) is a brilliant medical engineer on her first shuttle mission, with veteran astronaut Matt Kowalski (<a href=""/name/nm0000123?ref_=tt_stry_pl"">George Clooney</a>) in command of his last flight before retiring. But on a seemingly routine spacewalk, disaster strikes. The shuttle is destroyed, leaving Stone and Kowalsky completely alone - tethered to nothing but each other and spiraling out into the blackness.                ",Gravity
492,"Comedy, Drama","In Albuquerque Sheryl Hoover brings her suicidal brother Frank to the breast of her dysfunctional and emotionally bankrupted family. Frank is homosexual, an expert in Proust. He tried to commit suicide when he was rejected by his boyfriend and his great competitor became renowned and recognized as number one in the field of Proust. Sheryl's husband Richard is unsuccessfully trying to sell his self-help and self-improvement technique using nine steps to reach success, but he is actually a complete loser. Her son Dwayne has taken a vow of silence as a follower of Nietzsche and aims to be a jet pilot. Dwayne's grandfather Edwin was sent away from the institution for elders (Sunset Manor) and is addicted in heroin. When her seven-year-old daughter Olive has a chance to dispute the Little Miss Sunshine pageant in Redondo Beach, California, the whole family travels together in their old Volkswagen Type 2 (Kombi) in a funny journey of hope of winning the talent contest and to make a dream ...                ",Little Miss Sunshine
493,Comedy,"High school student Ferris Bueller wants a day off from school and he's developed an incredibly sophisticated plan to pull it off. He talks his friend Cameron into taking his father's prized Ferrari and with his girlfriend Sloane head into Chicago for the day. While they are taking in what the city has to offer school principal Ed Rooney is convinced that Ferris is, not for the first time, playing hooky for the day and is hell bent to catch him out. Ferris has anticipated that, much to Rooney's chagrin.                ",Ferris Bueller's Day Off
494,"Drama, Romance","Georges and Anne are a couple of retired music teachers enjoying life in their eighties. However, Anne suddenly has a stroke at breakfast and their lives are never the same. That incident begins Anne's harrowingly steep physical and mental decline as Georges attempts to care for her at home as she wishes. Even as the fruits of their lives and career remain bright, the couple's hopes for some dignity prove a dispiriting struggle even as their daughter enters the conflict. In the end, George, with his love fighting against his own weariness and diminished future on top of Anne's, is driven to make some critical decisions for them both.                ",Amour
495,"Drama, Musical, Romance","Veer Pratap Singh (Shah Rukh Khan) is an officer and pilot in the Indian Air Force who one day meets a beautiful Pakistani heiress, Zaara Hayaat Khan (Preity Zinta), as she travels to a small Indian village to scatter the ashes of one of her family's loyal servants. Veer has family in the village, and while most Indians show no affection for Pakistanis, his aunt and uncle are willing to take Zaara in for the night. It isn't long before Veer finds himself falling for her; however, Veer learns that Zaara is engaged to another man, Raza (Manoj Bajpai), a cruel and humorless Pakistani. A friend of Zaara contacts Veer and tells him that Zaara wants out of her engagement and has strong feelings for him, but when he comes to her rescue, matters take a turn for the worse and Veer winds up in jail. Twenty years later, Veer is still behind bars, and finds that his case is being given a new trial, but while he has a new chance at freedom, he discovers his lawyer will be going up against a state ...                ",Veer-Zaara
496,"Comedy, Crime, Drama","DJ Zack and pimp Jack end up in prison for being too laid-back to avoid being framed for crimes they didn't commit. They end up sharing a cell with eccentric Italian optimist Roberto, whose limited command of the English language is both entertaining and infuriating -but rather more useful to them is the fact that Roberto knows an escape route                ",Down by Law
497,"Animation, Action, Adventure","Batman, the costumed crime-fighter who prowls the night skies in Gotham City, soon finds there's another vigilante in town knocking off prominent mob figures. Despite the scythe-like blade for a hand, a mechanical voice and the cloud of smoke that follows the figure wherever it goes, the police and outraged officials mistake the homicidal crusader for Batman himself and demand that the city's longtime hero be brought to justice. Meanwhile, Andrea Beaumont returns to town. She is the lost love of Bruce Wayne, the billionaire playboy who is Batman's alter ego, and was an integral part of Wayne's decision ten years earlier to don the cape and cowl. Now, she is back in his life and is no less a disruption than the return of his old archenemy, The Joker, who has a stake in seeing the annihilation of this new vigilante, whoever it proves to be.                ",Batman: Mask of the Phantasm
498,"Family, Sci-Fi","While visiting the Earth at Night, a group of alien botanists is discovered and disturbed by an approaching human task force. Because of the more than hasty take-off, one of the visitors is left behind. The little alien finds himself all alone on a very strange planet. Fortunately, the extra-terrestrial soon finds a friend and emotional companion in 10-year-old Elliot, a lonely boy whose parents have separated. While E.T. slowly gets acquainted with Elliot's older brother Michael, his sister Gertie and the customs of Earth, members of the task force work day and night to track down the whereabouts of Earth's first visitor from outer space. The wish to go home again is strong in E.T., and after being able to communicate with Elliot and the others, E.T. starts building an improvised device to send a message home for his people to come and pick him up. But before long, E.T. gets seriously sick, and because of his special connection to Elliot, the young boy suffers, too. The situation ...                ",E.T. the Extra-Terrestrial
499,"Drama, Romance","Adèle is a high school student who is beginning to explore herself as a woman. She dates men but finds no satisfaction with them sexually, and is rejected by a female friend who she does desire. She dreams of something more. She meets Emma who is a free spirited girl whom Adèle's friends reject due to her sexuality, and by association most begin to reject Adèle. Her relationship with Emma grows into more than just friends as she is the only person with whom she can express herself openly. Together, Adèle and Emma explore social acceptance, sexuality, and the emotional spectrum of their maturing relationship.                ",Blue Is the Warmest Color
500,"Crime, Drama, Mystery","This English-language adaptation of the Swedish novel by Stieg Larsson follows a disgraced journalist, Mikael Blomkvist (<a href=""/name/nm0185819?ref_=tt_stry_pl"">Daniel Craig</a>), as he investigates the disappearance of a wealthy patriarch's niece from 40 years ago. He is aided by the pierced, tattooed, punk computer hacker named Lisbeth Salander (<a href=""/name/nm1913734?ref_=tt_stry_pl"">Rooney Mara</a>). As they work together in the investigation, Blomkvist and Salander uncover immense corruption beyond anything they have ever imagined.                ",The Girl with the Dragon Tattoo
501,Comedy,Dante Hicks is not having a good day. He works as a clerk in a small convenience store and is told to come into work on his day off. Dante thinks life is a series of down endings and this day is proving to no different. He reads in the newspaper that his ex-girlfriend Caitlin is getting married. His present girlfriend reveals to have somewhat more experience with sex that he ever imagined. His principal concerns are the hockey game he has that afternoon and the wake for a friend who died. His buddy Randal Graves works as a clerk in the video store next and he hates his job just about as much as Dante hates his.                ,Clerks
