,Genre,Plot,Title
240,"Crime, Drama","The film follows three young men and their time spent in the French suburban ""ghetto,"" over a span of twenty-four hours. Vinz, a Jew, Saïd, an Arab, and Hubert, a black boxer, have grown up in these French suburbs where high levels of diversity coupled with the racist and oppressive police force have raised tensions to a critical breaking point. During the riots that took place a night before, a police officer lost his handgun in the ensuing madness, only to leave it for Vinz to find. Now, with a newfound means to gain the respect he deserves, Vinz vows to kill a cop if his friend Abdel dies in the hospital, due the beating he received while in police custody.                ",La Haine
241,"Drama, Mystery, Sci-Fi","The Solaris mission has established a base on a planet that appears to host some kind of intelligence, but the details are hazy and very secret. After the mysterious demise of one of the three scientists on the base, the main character is sent out to replace him. He finds the station run-down and the two remaining scientists cold and secretive. When he also encounters his wife who has been dead for ten years, he begins to appreciate the baffling nature of the alien intelligence.                ",Solaris
242,"Adventure, Drama, Romance","In the Eighteenth Century, in a small village in Ireland, Redmond Barry is a young farm boy in love with his cousin Nora Brady. When Nora gets engaged to the British Captain John Quin, Barry challenges him to a duel of pistols. He wins and escapes to Dublin but is robbed on the road. Without an alternative, Barry joins the British Army to fight in the Seven Years War. He deserts and is forced to join the Prussian Army where he saves the life of his captain and becomes his protégé and spy of the Irish gambler Chevalier de Balibari. He helps Chevalier and becomes his associate until he decides to marry the wealthy Lady Lyndon. They move to England and Barry, in his obsession of nobility, dissipates her fortune and makes a dangerous and revengeful enemy.                ",Barry Lyndon
243,Drama,"A man wanders out of the desert after a four year absence. His brother finds him, and together they return to L.A. to reunite the man with his young son. Soon after, he and the boy set out to locate the mother of the child, who left shortly after the man disappeared.                ","Paris, Texas"
244,Drama,"George and Martha are a middle aged married couple, whose charged relationship is defined by vitriolic verbal battles, which underlies what seems like an emotional dependence upon each other. This verbal abuse is fueled by an excessive consumption of alcohol. George being an associate History professor in a New Carthage university where Martha's father is the President adds an extra dimension to their relationship. Late one Saturday evening after a faculty mixer, Martha invites Nick and Honey, an ambitious young Biology professor new to the university and his mousy wife, over for a nightcap. As the evening progresses, Nick and Honey, plied with more alcohol, get caught up in George and Martha's games of needing to hurt each other and everyone around them. The ultimate abuse comes in the form of talk of George and Martha's unseen sixteen year old son, whose birthday is the following day.                ",Who's Afraid of Virginia Woolf?
245,"Comedy, Drama","Journalist and man-about-town Marcello struggles to find his place in the world, torn between the allure of Rome's elite social scene and the stifling domesticity offered by his girlfriend, all the while searching for a way to become a serious writer.                ",La Dolce Vita
246,"Crime, Film-Noir, Thriller","Bruno Anthony thinks he has the perfect plot to rid himself of his hated father and when he meets tennis player Guy Haines on a train, he thinks he's found the partner he needs to pull it off. His plan is relatively simple. Two strangers each agree to kill someone the other person wants disposed of. For example, Guy could kill his father and he could get rid of Guy's wife Miriam, freeing him to marry Anne Morton, the beautiful daughter of a U.S. Senator. Guy dismisses it all out of hand but but Bruno goes ahead with his half of the 'bargain' and disposes of Miriam. When Guy balks, Bruno makes it quite clear that he will plant evidence to implicate Guy in her murder if he doesn't get rid of his father. Guy had also made some unfortunate statements about Miriam after she had refused him a divorce. It all leads the police to believe Guy is responsible for the murder, forcing him to deal with Bruno's mad ravings.                ",Strangers on a Train
247,"Horror, Mystery","Francis, a young man, recalls in his memory the horrible experiences he and his fiancée Jane recently went through. It is the annual fair in Holstenwall. Francis and his friend Alan visit The Cabinet of Dr. Caligari, an exhibit where the mysterious doctor shows the somnambulist Cesare, and awakens him for some moments from his death-like sleep. When Alan asks Cesare about his future, Cesare answers that he will die before dawn. The next morning Alan is found dead. Francis suspects Cesare of being the murderer, and starts spying on him and Dr. Caligari. The following night Cesare is going to stab Jane in her bed, but softens when he sees the beautiful woman, and instead of committing another murder, he abducts her. Jane's father awakens because of the noise, and he and some servants follow the fleeing Cesare. When Cesare cannot outrun his pursuers anymore, he gently places Jane down on the ground, and runs away. Francis and the police investigate the caravan of Dr. Caligari, but the ...                ",The Cabinet of Dr. Caligari
248,Drama,"Sad story of a waif, Gelsomina, who is sold by her mother to Zampano for 10,000 lire and a few kilos of food. Zampano is a traveling showman who exhibits feats of strength by breaking a chain wrapped around his chest. He performs in village squares and then passes the hat for whatever the normally small crowd is prepared to give. He teaches Gelsomina a drum roll as part of his introduction. He doesn't treat her well and when she tries to run away, he beats her. They eventually join a small traveling circus where they meet a tight-rope walker who convinces Gelsomina to question her choices.                ",La Strada
249,"Action, Adventure, Sci-Fi","After stealing a mysterious orb in the far reaches of outer space, Peter Quill from Earth, is now the main target of a manhunt led by the villain known as Ronan the Accuser. To help fight Ronan and his team and save the galaxy from his power, Quill creates a team of space heroes known as the ""Guardians of the Galaxy"" to save the world.                ",Guardians of the Galaxy
250,Drama,"In the midst of the Korean wilderness, a Buddhist master patiently raises a young boy to grow up in wisdom and compassion, through experience and endless exercises. Once the pupil discovers his sexual lust, he seems lost to contemplative life and follows his first love, but soon fails to adapt to the modern world, gets in jail for a crime of passion and returns to the master in search of spiritual redemption and reconciliation with karma, at a high price of physical catharsis...                ","Spring, Summer, Fall, Winter... and Spring"
251,Drama,"The Father turns 60. His family, which is a big one of the kind, gathers to celebrate him on a castle. Everybody likes and respects the father deeply...or do they? The youngest son is trying to live up to the father's expectations. He is running a grill-bar in a dirty part of Copenhagen. The oldest son runs a restaurant in France, while the sister is a anthropologist. The older sister has recently committed suicide and the father asks the oldest son to say a few words about her, because he is afraid he will break into tears if he does it himself. The oldest son agrees without argument. Actually he has already written two speeches. A yellow and a green one. By the table, he asks the father to pick a speech. The father chooses green. The oldest son announces that this is the Speech of Truth. Everybody laughs, except for the father who gets a nervous look on his face. For he knows that the oldest son is about to reveal the secret of why the oldest sister killed herself.                ",The Celebration
252,"Mystery, Thriller","Milo Tindle and Andrew Wyke have something in common, Andrew's wife. In an attempt to find a way out of this without costing Andrew a fortune in alimony, he suggests Milo pretend to rob his house and let him claim the insurance on the stolen jewelry. The problem is that they don't really like each other and each cannot avoid the zinger on the other. The plot has many shifts in which the advantage shifts between Milo and Andrew.                ",Sleuth
253,"Action, Crime, Drama","After a bloody invasion of the BOPE in the High-Security Penitentiary Bangu 1 in Rio de Janeiro to control a rebellion of interns, the Lieutenant-Colonel Roberto Nascimento and the second in command Captain André Matias are accused by the Human Right Aids member Diogo Fraga of execution of prisoners. Matias is transferred to the corrupted Military Police and Nascimento is exonerated from the BOPE by the Governor. However, due to the increasing popularity of Nascimento, the Governor invites him to team-up with the intelligence area of the Secretary of Security. Along the years, Fraga, who is married with Nascimento's former wife, is elected State Representative and Nascimento's son Rafael has issues with his biological father. Meanwhile Nascimento and the BOPE expel the drug dealers from several slums but another enemy arises: the militia led by Major Rocha and supported by the Governor, the Secretary of Security and politicians interested in votes. Nascimento is manipulated to help ...                ",Elite Squad: The Enemy Within
254,"Action, Thriller","Bourne is once again brought out of hiding, this time inadvertently by London-based reporter Simon Ross who is trying to unveil Operation Blackbriar--an upgrade to Project Treadstone--in a series of newspaper columns. Bourne sets up a meeting with Ross and realizes instantly they're being scanned. Information from the reporter stirs a new set of memories, and Bourne must finally, ultimately, uncover his dark past whilst dodging The Company's best efforts in trying to eradicate him.                ",The Bourne Ultimatum
255,"Adventure, Family, Fantasy","In this charming film based on the popular L. Frank Baum stories, Dorothy and her dog Toto are caught in a tornado's path and somehow end up in the land of Oz. Here she meets some memorable friends and foes in her journey to meet the Wizard of Oz who everyone says can help her return home and possibly grant her new friends their goals of a brain, heart and courage.                ",The Wizard of Oz
256,"Action, Biography, Drama","In 1935 in Foshan, south China, there are martial arts schools on every street corner. Ip Man is the undisputed martial arts champion, yet he has not devoted himself to teaching. Despite this, it seems that all the kung fu masters of the city are eager to fight him to improve their reputation.                ",Ip Man
257,"Drama, Fantasy, Romance","Visible only to those like them and to human children, Damiel and Cassiel are two angels, who have existed even before humankind. Along with several other angels, they currently wander around West Berlin, generally on their own, observing and preserving life, sometimes trying to provide comfort to the troubled, although those efforts are not always successful. Among those they are currently observing are: the cast and crew of a movie - a detective story set in WWII Nazi Germany - which include a sensitive and perceptive <a href=""/name/nm0000393?ref_=tt_stry_pl"">Peter Falk</a>; an elderly man named Homer looking for eternal peace; and the troupe of a financially failing circus, which has closed early for the season because of those financial problems. One day, Damiel tells Cassiel that he wants to become human, to feel not only the sensory aspects of physical beings, but also emotional aspects. He embarks on this thought with the full realization that there is no turning back if he decides to do so. His thoughts are largely ...                ",Wings of Desire
258,"Animation, Adventure, Family","A young boy stumbles into a mysterious girl who floats down from the sky. The girl, Sheeta, was chased by pirates, army and government secret agents. In saving her life, they begin a high flying adventure that goes through all sorts of flying machines, eventually searching for Sheeta's identity in a floating castle of a lost civilization.                ",Castle in the Sky
259,"Adventure, Sci-Fi, Thriller","Huge advancements in scientific technology have enabled a mogul to create an island full of living dinosaurs. John Hammond has invited four individuals, along with his two grandchildren, to join him at Jurassic Park. But will everything go according to plan? A park employee attempts to steal dinosaur embryos, critical security systems are shut down and it now becomes a race for survival with dinosaurs roaming freely over the island.                ",Jurassic Park
260,"Crime, Thriller","Four tales of crime adapted from Frank Miller's popular comics, focusing around a muscular brute who's looking for the person responsible for the death of his beloved Goldie, a man fed up with Sin City's corrupt law enforcement who takes the law into his own hands after a horrible mistake, a cop who risks his life to protect a girl from a deformed pedophile, and a hitman looking to make a little cash.                ",Sin City
261,"Drama, Mystery, Romance","Valentine is a young model living in Geneva. Because of a dog she ran over, she meets a retired judge who spies his neighbours' phone calls, not for money but to feed his cynicism. The film is the story of relationships between some human beings, Valentine and the judge, but also other people who may not be aware of the relationship they have with Valentine or/and the old judge. Redemption, forgiveness and compassion...                ",Three Colors: Red
262,"Drama, Romance","Set in Hong Kong, 1962, Chow Mo-Wan is a newspaper editor who moves into a new building with his wife. At the same time, Su Li-zhen, a beautiful secretary and her executive husband also move in to the crowded building. With their spouses often away, Chow and Li-zhen spend most of their time together as friends. They have everything in common from noodle shops to martial arts. Soon, they are shocked to discover that their spouses are having an affair. Hurt and angry, they find comfort in their growing friendship even as they resolve not to be like their unfaithful mates.                ",In the Mood for Love
263,"Action, Crime, Drama","In 1997, before the visit of the pope to Rio de Janeiro, Captain Nascimento from BOPE (Special Police Operation Battalion) is assigned to eliminate the risks of the drug dealers in a dangerous slum nearby where the pope intends to be lodged. Captain Nascimento is trying to find a man to replace him because his wife is pregnant and he intends to quit the command and become a trainer of the new recruits. Meanwhile, the two idealistic friends Neto and Matias join the Military Police force expecting to become honest policemen and fight the criminals. However, they see only corruption, lack of competence and stupid bureaucracy in the Military Police, and after a serious incident in the Morro da Babilônia, they decide to join the BOPE. The lives of Capitain Nascimento, Neto and Matias are entwined along the next months, first in the tough training period and then in action against drug dealers. Nascimento believes that Neto could be his substitute, but his impulsive attitudes jeopardizes ...                ",Elite Squad
264,"Crime, Drama, Mystery","Frederick Manion (Ben Gazzara), a lieutenant in the army, is arrested for the murder of a bartender, Barney Quill. He claims, in his defense, that the victim had raped and beaten up his wife Laura (Lee Remick). Although Laura supports her husband's story, the police surgeon can find no evidence that she has been raped. Manion is defended by Paul Biegler (James Stewart), a rather humble small-town lawyer. During the course of interviews, Biegler discovers that Manion is violently possessive and jealous, and also that his wife has a reputation for giving her favors to other men. Biegler realizes that the prosecution will try to make the court believe that Laura was the lover of the bartender and than Manion killed him and beat her up when he discovered them together. Manion pleads ""not guilty"" and Biegler, who knows that his case is weak, sets his assistants to try to find a witness who will save Manion.                ",Anatomy of a Murder
265,"Comedy, Romance","Joe Bradley is a reporter for the American News Service in Rome, a job he doesn't much like as he would rather work for what he considers a real news agency back in the States. He is on the verge of getting fired when he, sleeping in and getting caught in a lie by his boss Hennessy, misses an interview with HRH Princess Ann, who is on a goodwill tour of Europe, Rome only her latest stop. However, he thinks he may have stumbled upon a huge scoop. Princess Ann has officially called off all her Rome engagements due to illness. In reality, he recognizes the photograph of her as being the young well but simply dressed drunk woman he rescued off the street last night (as he didn't want to turn her into the police for being a vagrant), and who is still in his small studio apartment sleeping off her hangover. What Joe doesn't know is that she is really sleeping off the effects of a sedative given to her by her doctor to calm her down after an anxiety attack, that anxiety because she hates her...                ",Roman Holiday
266,"Biography, Drama, Thriller","Based on the real life story of legendary cryptanalyst Alan Turing, the film portrays the nail-biting race against time by Turing and his brilliant team of code-breakers at Britain's top-secret Government Code and Cypher School at Bletchley Park, during the darkest days of World War II.                ",The Imitation Game
267,Western,"When Senator Ransom Stoddard returns home to Shinbone for the funeral of Tom Doniphon, he recounts to a local newspaper editor the story behind it all. He had come to town many years before, a lawyer by profession. The stage was robbed on its way in by the local ruffian, Liberty Valance, and Stoddard has nothing to his name left save a few law books. He gets a job in the kitchen at the Ericson's restaurant and there meets his future wife, Hallie. The territory is vying for Statehood and Stoddard is selected as a representative over Valance, who continues terrorizing the town. When he destroys the local newspaper office and attacks the editor, Stoddard calls him out, though the conclusion is not quite as straightforward as legend would have it.                ",The Man Who Shot Liberty Valance
268,"Action, Drama, Western","On the day he gets married and hangs up his badge, lawman Will Kane is told that a man he sent to prison years before, Frank Miller, is returning on the noon train to exact his revenge. Having initially decided to leave with his new spouse, Will decides he must go back and face Miller. However, when he seeks the help of the townspeople he has protected for so long, they turn their backs on him. It seems Kane may have to face Miller alone, as well as the rest of Miller's gang, who are waiting for him at the station...                ",High Noon
269,"Drama, Sport","Rocky Balboa is a struggling boxer trying to make the big time, working as a debt collector for a pittance. When heavyweight champion Apollo Creed visits Philadelphia, his managers want to set up an exhibition match between Creed and a struggling boxer, touting the fight as a chance for a ""nobody"" to become a ""somebody"". The match is supposed to be easily won by Creed, but someone forgot to tell Rocky, who sees this as his only shot at the big time.                ",Rocky
270,"Comedy, Romance","Philadelphia socialites Tracy Lord and C.K. Dexter Haven married impulsively, with their marriage and subsequent divorce being equally passionate. They broke up when Dexter's drinking became excessive, it a mechanism to cope with Tracy's unforgiving manner to the imperfect, imperfections which Dexter admits he readily has. Two years after their break-up, Tracy is about to remarry, the ceremony to take place at the Lord mansion. Tracy's bridegroom is nouveau riche businessman and aspiring politician George Kittredge, who is otherwise a rather ordinary man and who idolizes Tracy. The day before the wedding, three unexpected guests show up at the Lord mansion: Macaulay Connor (Mike to his friends), Elizabeth Imbrie - the two who are friends of Tracy's absent brother, Junior - and Dexter himself. Dexter, an employee of the tabloid Spy magazine, made a deal with its publisher and editor Sidney Kidd to get a story on Tracy's wedding - the wedding of the year - in return for Kidd not ...                ",The Philadelphia Story
271,Drama,"Set in Mississippi during the 1960s, Skeeter (Stone) is a southern society girl who returns from college determined to become a writer, but turns her friends' lives -- and a Mississippi town -- upside down when she decides to interview the black women who have spent their lives taking care of prominent southern families. Aibileen (Davis), Skeeter's best friend's housekeeper, is the first to open up -- to the dismay of her friends in the tight-knit black community. Despite Skeeter's life-long friendships hanging in the balance, she and Aibileen continue their collaboration and soon more women come forward to tell their stories -- and as it turns out, they have a lot to say. Along the way, unlikely friendships are forged and a new sisterhood emerges, but not before everyone in town has a thing or two to say themselves when they become unwittingly -- and unwillingly -- caught up in the changing times.                ",The Help
272,"Comedy, Drama, War","It's a dreary Christmas 1944 for the American POWs in Stalag 17. For the men in Barracks 4, all sergeants, have to deal with a grave problem - there seems to be a security leak. The Germans always seem to be forewarned about escapes and in the most recent attempt the two men, Manfredi and Johnson, walked straight into a trap and were killed. For some in Barracks 4, especially the loud-mouthed Duke, the leaker is obvious: J.J. Sefton, a wheeler-dealer who doesn't hesitate to trade with the guards and who has acquired goods and privileges that no other prisoner seems to have. Sefton denies giving the Germans any information and makes it quite clear that he has no intention of ever trying to escape. He plans to ride out the war in what little comfort he can arrange, but it doesn't extend to spying for the Germans. As tensions mount and a mob mentality takes root, it becomes obvious that Sefton will have to find the real snitch if he is to have any peace and avoid the beatings Duke and ...                ",Stalag 17
273,"Comedy, Crime, Thriller","Mortimer Brewster is a newspaperman and author known for his diatribes against marriage. We watch him being married at city hall in the opening scene. Now all that is required is a quick trip home to tell Mortimer's two maiden aunts. While trying to break the news, he finds out his aunts' hobby; killing lonely old men and burying them in the cellar. It gets worse.                ",Arsenic and Old Lace
274,"Drama, Film-Noir, Romance","Following the conviction of her German father for treason against the U.S., Alicia Huberman takes to drink and men. She is approached by a government agent (T.R. Devlin) who asks her to spy on a group of her father's Nazi friends operating out of Rio de Janeiro. A romance develops between Alicia and Devlin, but she starts to get too involved in her work.                ",Notorious
275,"Crime, Drama, Film-Noir","It's the Great Depression. In the process of robbing a bank of $10,000, Ben Harper kills two people. Before he is captured, he is able to convince his adolescent son John and his daughter Pearl not to tell anyone, including their mother Willa, where he hid the money, namely in Pearl's favorite toy, a doll that she carries everywhere with her. Ben, who is captured, tried and convicted, is sentenced to death. But before he is executed, Ben is in the state penitentiary with a cell mate, a man by the name of Harry Powell, a self-professed man of the cloth, who is really a con man and murderer, swindling lonely women, primarily rich widows, of their money before he kills them. Harry does whatever he can, unsuccessfully, to find out the location of the $10,000 from Ben. After Ben's execution, Harry decides that Willa will be his next mark, figuring that someone in the family knows where the money is hidden. Despite vowing not to remarry, Willa ends up being easy prey for Harry's outward ...                ",The Night of the Hunter
276,"Animation, Action, Sci-Fi","Kaneda is a bike gang leader whose close friend Tetsuo gets involved in a government secret project known as Akira. On his way to save Tetsuo, Kaneda runs into a group of anti-government activists, greedy politicians, irresponsible scientists and a powerful military leader. The confrontation sparks off Tetsuo's supernatural power leading to bloody death, a coup attempt and the final battle in Tokyo Olympiad where Akira's secrets were buried 30 years ago.                ",Akira
