,Genre,Plot,Title
735,"Adventure, Comedy, Drama","In Mexico City, late teen friends Tenoch Iturbide and Julio Zapata are feeling restless as their respective girlfriends are traveling together through Europe before they all begin the next phase of their lives at college. At a lavish family wedding, Tenoch and Julio meet Luisa Cortés, the twenty-something wife of Tenoch's cousin Jano, the two who have just moved to Mexico from Spain. Tenoch and Julio try to impress the beautiful Luisa by telling her that they will be taking a trip to the most beautiful secluded beach in Mexico called la Boca del Cielo (translated to Heaven's Mouth), the trip and the beach which in reality don't exist. When Luisa learns of Jano's latest marital indiscretion straight from the horse's mouth, she takes Tenoch and Julio's offer to go along on this road trip, meaning that Tenoch and Julio have to pull together quickly a road trip to a non-existent beach. They decide to head toward one suggested by their friend Saba, who seems a little confused himself of ...                ",Y Tu Mamá También
736,"Biography, Drama, Music","An un-chronological look at the life of the Little Sparrow, Édith Piaf (1915-1963). Her mother is an alcoholic street singer, her father a circus performer, her paternal grandmother a madam. During childhood she lives with each of them. At 20, she's a street singer discovered by a club owner who's soon murdered, coached by a musician who brings her to concert halls, and then quickly famous. Constant companions are alcohol and heartache. The tragedies of her love affair with Marcel Cerdan and the death of her only child belie the words of one of her signature songs, ""Non, je ne regrette rien."" The back and forth nature of the narrative suggests the patterns of memory and association.                ",La Vie en Rose
737,"Crime, Drama, Horror","After a thirteen-year imprisonment for the kidnap and murder of a six-year-old boy, Guem-Ja Lee seeks vengeance on the man truly responsible for the boy's death. With the help of fellow inmates and reunited with her daughter, she gets closer and closer to her goal.                ",Sympathy for Lady Vengeance
738,"Drama, Romance","Haunted by a secret, Ben Thomas looks for redemption by radically transforming the lives of seven people he doesn't know. Once his plan is set, nothing will be able to stop him. At least that's what he thinks. But Ben hadn't planned on falling in love with one of these people and she's the one who will end up transforming him.                ",Seven Pounds
739,"Biography, Crime, Drama","On October 6, 1970 while boarding an international flight out of Istanbul Airport, American <a href=""/name/nm0370907?ref_=tt_stry_pl"">Billy Hayes</a> is caught attempting to smuggle 2 kilos of hashish out of the country, the drugs strapped to his body. He is told that he will be released if he cooperates with the authorities in identifying the person who actually sold him the hash. Billy's troubles really begin when after that assistance, he makes a run for it and is recaptured. He is initially sentenced to just over four years for possession, with no time for the more harsh crime of smuggling. The prison environment is inhospitable in every sense, with a sadistic prison guard named Hamidou ruling the prison, he who relishes the mental and physical torture he inflicts on the prisoners for whatever reason. Told to trust no one, Billy does befriend a few of the other inmates, namely fellow American Jimmy Booth (in for stealing two candlesticks from a mosque), a Swede named Erich, and one of the senior prisoners having already ...                ",Midnight Express
740,"Film-Noir, Mystery, Romance","The head of the Green Manors mental asylum Dr. Murchison is retiring to be replaced by Dr. Edwardes, a famous psychiatrist. Edwardes arrives and is immediately attracted to the beautiful but cold Dr. Constance Petersen. However, it soon becomes apparent that Dr. Edwardes is in fact a paranoid amnesiac impostor. He goes on the run with Constance who tries to help his condition and solve the mystery of what happened to the real Dr. Edwardes.                ",Spellbound
741,"Adventure, Comedy, War","During World War II a German Colonel is captured by the Americans but before he can be interrogated an artillery barrage hits the camp. However, Ex-Lieutenant Kelly manages to reach the Colonel, get him drunk and learn that he is on a secret mission to ship $16,000,000 of gold to a base in France. Kelly is determined to get the gold and plans for himself and a few of his fellow soldiers to slip into enemy territory and steal the bullion.                ",Kelly's Heroes
742,"Drama, Mystery, Thriller","Fred Madison, a saxophonist, is accused under mysterious circumstances of murdering his wife Renee. On death row, he inexplicably morphs into a young man named Pete Dayton, leading a completely different life. When Pete is released, his and Fred's paths begin to cross in a surreal, suspenseful web of intrigue, orchestrated by a shady gangster boss named Dick Laurent.                ",Lost Highway
743,"Action, Adventure, Sci-Fi","In the twenty-third century, the universe is threatened by evil. The only hope for mankind is the Fifth Element, who comes to Earth every five thousand years to protect the humans with four stones of the four elements: fire, water, Earth and air. A Mondoshawan spacecraft is bringing The Fifth Element back to Earth but it is destroyed by the evil Mangalores. However, a team of scientists use the DNA of the remains of the Fifth Element to rebuild the perfect being called Leeloo. She escapes from the laboratory and stumbles upon the taxi driver and former elite commando major Korben Dallas that helps her to escape from the police. Leeloo tells him that she must meet Father Vito Cornelius to accomplish her mission. Meanwhile, the Evil uses the greedy and cruel Jean-Baptiste Emanuel Zorg and a team of mercenary Mangalores to retrieve the stones and avoid the protection of Leeloo. But the skilled Korben Dallas has fallen in love with Leeloo and decides to help her to retrieve the stones.                ",The Fifth Element
744,"Comedy, Drama","A studio script screener gets on the bad side of a writer by not accepting his script. The writer is sending him threatening postcards. The screener tries to identify the writer in order to pay him off so he'll be left alone, and then in a case of mistaken identity gone awry, he accidentally gives the writer solid ammunition for blackmail. This plot is written on a backdrop of sleazy Hollywood deals and several subplots involving the politics of the industry.                ",The Player
745,"Action, Adventure, Drama","Enzo and Jacques have known each other for a long time. Their friendship started in their childhood days in the Mediterranean. They were not real friends in these days, but there was something they both loved and used to do the whole day long: diving. One day Jacques' father, who was a diver too, died in the Mediterranean sea. After that incident Enzo and Jacques lost contact. After several years, Enzo and Jacques had grown up, Johanna, a young clerk in a security office, has to go to Peru. There she meets Jacques who works for a group of scientists. He dives for some minutes into ice-cold water and the scientists monitor his physical state that is more like a dolphin's than a human's. Johanna can not believe what she sees and gets very interested in Jacques but she's unable to get acquainted with him. Some weeks later, back in her office, she notices a championship for divers that is supposed to take place in Taormina, Italy. In order to see Jacques again she makes up a story so the ...                ",The Big Blue
746,"Crime, Drama, Thriller","A modern day look at America's war on drugs told through four separate stories that are connected in one way or another. A conservative judge who's just been appointed as the US drug czar learns that his teenage honor student daughter is a drug addict. A beautiful trophy wife struggles to save her wealthy husband's drug business, while two DEA agents protect a witness with inside knowledge of the spouse's business. In Mexico, a slightly corrupt, yet dedicated cop struggles with his conscience when he learns that his new boss may not be the anti-drug official he made himself out to be.                ",Traffic
747,"Drama, Musical, Romance","The year is 1899, and Christian, a young English writer, has come to Paris to follow the Bohemian revolution taking hold of the city's drug and prostitute infested underworld. And nowhere is the thrill of the underworld more alive than at the Moulin Rouge, a night club where the rich and poor men alike come to be entertained by the dancers, but things take a wicked turn for Christian as he starts a deadly love affair with the star courtesan of the club, Satine. But her affections are also coveted by the club's patron: the Duke. A dangerous love triangle ensues as Satine and Christian attempt to fight all odds to stay together but a force that not even love can conquer is taking its toll on Satine...                ",Moulin Rouge!
748,"Action, Mystery, Sci-Fi","In a gritty and alternate 1985 the glory days of costumed vigilantes have been brought to a close by a government crackdown, but after one of the masked veterans is brutally murdered an investigation into the killer is initiated. The reunited heroes set out to prevent their own destruction, but in doing so discover a deeper and far more diabolical plot.                ",Watchmen
749,Drama,"Evelyn Couch is having trouble in her marriage, and no one seems to take her seriously. While in a nursing home visiting relatives, she meets Ninny Threadgoode, an outgoing old woman, who tells her the story of Idgie Threadgoode, a young woman in 1920's Alabama. Through Idgie's inspiring life, Evelyn learns to be more assertive and builds a lasting friendship of her own with Ninny.                ",Fried Green Tomatoes
750,"Action, Drama, Sci-Fi","A growing nation of genetically evolved apes led by Caesar is threatened by a band of human survivors of the devastating virus unleashed a decade earlier. They reach a fragile peace, but it proves short-lived, as both sides are brought to the brink of a war that will determine who will emerge as Earth's dominant species.                ",Dawn of the Planet of the Apes
751,"Crime, Drama, Mystery","From a cell, a man tells us he has planned the perfect bank robbery; he invites us to watch. An efficient gang enters a Manhattan bank, locks the doors, and takes hostages. They work deliberately, without haste. Detective Frazier is assigned to negotiate, but half his mind is occupied with the corruption charges he is facing. The bank's president has something to protect in a safe deposit box, so he brings in Madeleine White, a high-power broker with a hidden agenda. With an army of police surrounding the bank, the thief, the cop, and the plutocrat's fixer enter high-stakes negotiations. Why are the robbers asking for a plane, if they are so competent and they know they won't get one? Why aren't they in more of a hurry? If the job's perfect, why is the thieves' leader in a cell?                ",Inside Man
752,"Action, Adventure, Fantasy","Three years after the onset of the Clone Wars; the noble Jedi Knights are spread out across the galaxy leading a massive clone army in the war against the Separatists. After Chancellor Palpatine is kidnapped, Jedi Master Obi-Wan Kenobi and his former Padawan, Anakin Skywalker, are dispatched to eliminate the evil General Grievous. Meanwhile, Anakin's friendship with the Chancellor arouses suspicion in the Jedi Order, and dangerous to the Jedi Knight himself. When the sinister Sith Lord, Darth Sidious, unveils a plot to take over the galaxy, the fate of Anakin, the Jedi order, and the entire galaxy is at stake. Upon his return, Anakin Skywalker's wife Padme Amidala is pregnant, but he is having visions of her dying in childbirth. Anakin Skywalker ultimately turns his back on the Jedi, thus completing his journey to the dark side and his transformation into Darth Vader. Obi-Wan Kenobi must face his former apprentice in a ferocious lightsaber duel on the fiery world of Mustafar.",Star Wars: Episode III - Revenge of the Sith
753,"Action, Horror, Thriller","A double-bill of thrillers that recall both filmmakers' favorite exploitation films. ""Grindhouse"" (a downtown movie theater in disrepair since its glory days as a movie palace known for ""grinding out"" non-stop double-bill programs of B-movies) is presented as one full-length feature comprised of two individual films helmed separately by each director. ""Death Proof,"" is a rip-roaring slasher flick where the killer pursues his victims with a car rather than a knife, while ""Planet Terror"" shows us a view of the world in the midst of a zombie outbreak. The films are joined together by clever faux trailers that recall the '50s exploitation drive-in classics.                ",Grindhouse
754,"Comedy, War, Drama","The personnel at the 4077 MASH unit deal with the horrors of the Korean War and the stresses faced in surgery by whatever means. The tone at the MASH is established by recent arrivals, surgeons Captains 'Hawkeye' Pierce, 'Duke' Forrest, and 'Trapper' John McIntyre - the latter who Hawkeye knows he's met somewhere, but Trapper who won't divulge where - whose antics can be best described as non-regulation, and in the negative words of one of their fellow MASH-ers: unmilitary. The unit's commanding officer, Colonel Henry Blake, doesn't care about this behavior as long as it doesn't affect him, and as long as they do their job and do it well, which they do. Their behavior does extremely bother fellow surgeon, Major Frank Burns, and recently arrived head nurse, Major Margaret Houlihan, who obtains the nickname 'Hot Lips' based on information they glean about her through underhanded means. Beyond their battles with Frank and Hot Lips, Hawkeye, Duke and/or Trapper help unit dentist Painless ...                ",MASH
755,"Adventure, Family, Fantasy","Harry's fourth year at Hogwarts is about to start and he is enjoying the summer vacation with his friends. They get the tickets to The Quidditch World Cup Final but after the match is over, people dressed like Lord Voldemort's 'Death Eaters' set a fire to all the visitors' tents, coupled with the appearance of Voldemort's symbol, the 'Dark Mark' in the sky, which causes a frenzy across the magical community. That same year, Hogwarts is hosting 'The Triwizard Tournament', a magical tournament between three well-known schools of magic : Hogwarts, Beauxbatons and Durmstrang. The contestants have to be above the age of 17, and are chosen by a magical object called Goblet of Fire. On the night of selection, however, the Goblet spews out four names instead of the usual three, with Harry unwittingly being selected as the Fourth Champion. Since the magic cannot be reversed, Harry is forced to go with it and brave three exceedingly difficult tasks.                ",Harry Potter and the Goblet of Fire
756,"Comedy, Crime, Mystery",A petty thief posing as an actor is brought to Los Angeles for an unlikely audition and finds himself in the middle of a murder investigation along with his high school dream girl and a detective who's been training him for his upcoming role...                ,Kiss Kiss Bang Bang
757,"Drama, Family","On the east coast of New Zealand, the Whangara people believe their presence there dates back a thousand years or more to a single ancestor, Paikea, who escaped death when his canoe capsized by riding to shore on the back of a whale. From then on, Whangara chiefs, always the first-born, always male, have been considered Paikea's direct descendants. Pai, an 11-year-old girl in a patriarchal New Zealand tribe, believes she is destined to be the new chief. But her grandfather Koro is bound by tradition to pick a male leader. Pai loves Koro more than anyone in the world, but she must fight him and a thousand years of tradition to fulfill her destiny.                ",Whale Rider
758,"Comedy, Drama, Fantasy","Everybody knows that your life is a story. But what if a story was your life? Harold Crick is your average IRS agent: monotonous, boring, and repetitive. But one day this all changes when Harold begins to hear an author inside his head narrating his life. The narrator it is extraordinarily accurate, and Harold recognizes the voice as an esteemed author he saw on TV. But when the narration reveals that he is going to die, Harold must find the author of the story, and ultimately his life, to convince her to change the ending of the story before it is too late.                ",Stranger Than Fiction
759,"Biography, Drama","When former journalist Martin Sixsmith is dismissed from the Labour Party in disgrace, he is at a loss as to what do. That changes when a young Irish woman approaches him about a story of her mother, Philomena, who had her son taken away when she was a teenage inmate of a Catholic convent. Martin arranges a magazine assignment about her search for him that eventually leads to America. Along the way, Martin and Philomena discover as much about each other as about her son's fate. Furthermore, both find their basic beliefs challenged.                ",Philomena
760,"Comedy, Drama","Three grown prodigies, all with a unique genius of some kind, and their mother are staying at the family household. Their father, Royal had left them long ago, and comes back to make things right with his family.                ",The Royal Tenenbaums
761,Drama,"Sam Dawson has the mental capacity of a 7-year-old. He works at a Starbucks and is obsessed with the Beatles. He has a daughter with a homeless woman; she abandons them as soon as they leave the hospital. He names his daughter Lucy Diamond (after the Beatles song), and raises her. But as she reaches age 7 herself, Sam's limitations start to become a problem at school; she's intentionally holding back to avoid looking smarter than him. The authorities take her away, and Sam shames high-priced lawyer Rita Harrison into taking his case pro bono. In the process, he teaches her a great deal about love, and whether it's really all you need.                ",I Am Sam
762,"Drama, Thriller","In this dramatic courtroom thriller, LT Daniel Kaffee, a Navy lawyer who has never seen the inside of the courtroom, defends two stubborn Marines who have been accused of murdering a colleague. Kaffee is known as being lazy and had arranged for a plea bargain. Downey's Aunt Ginny appoints Cmdr. Galloway to represent him. Also on the legal staff is LTJG Sam Weinberg. The team rounds up many facts and Kaffee is discovering that he is really cut out for trial work. The defense is originally based upon the fact that PFC Santiago, the victim, was given a ""CODE RED"". Santiago was basically a screw-up. At Gitmo, screw-ups aren't tolerated. Especially by Col. Nathan Jessup. In Cuba, Jessup and two senior officers try to give all the help they can, but Kaffee knows something's fishy. In the conclusion of the film, the fireworks are set off by a confrontation between Jessup and Kaffee.                ",A Few Good Men
763,"Horror, Mystery","Sgt. Howie travels to Summerisle to investigate the disappearance of a young girl. He discovers that the locals are weird and unhelpful, and becomes determined to get to the bottom of the disappearance.                ",The Wicker Man
764,"Action, Adventure, Sci-Fi",A former Australian policeman now living in the post-apocalyptic Australian outback as a warrior agrees to help a community of survivors living in a gasoline refinery to defend them and their gasoline supplies from evil barbarian warriors.                ,Mad Max 2: The Road Warrior
765,"Drama, War","In World War II, the outcome of the battle of Guadalcanal will strongly influence the Japanese advance into the Pacific theater. A group of young soldiers is brought in as a relief for the battle-weary Marines. The exhausting fight for a strategically-positioned airfield that allows control over a 1000-mile radius puts the men of the Army rifle company C-for-Charlie through hell. The horrors of war form the soldiers into a tight-knit group; their emotions develop into bonds of love and even family. The reasons for this war get further away as the world for the men gets smaller and smaller until their fighting is for mere survival and the life of the other men with them.                ",The Thin Red Line
766,Western,"A Stranger rides into in the dusty mining town of Lago, where the townspeople are living in the shadow of a dark secret. After a shootout leaves the town's hired-gun protectors dead, the town's leaders petition the Stranger to stay and protect them from three ruthless outlaws who are soon to be released from prison. The three have their sights set on returning to Lago to wreak havoc and take care of some unfinished business. A series of events soon has the townspeople questioning whether siding with the Stranger was a wise idea as they quickly learn the price that they each must pay for his services. As the outlaws make their way back into Lago, they discover that the town is not exactly as they had left it, and waiting in the shadows is the Stranger, ready to expose the town's secret and serve up his own brand of justice.                ",High Plains Drifter
767,"Animation, Adventure, Family","Abandoned after an accident, baby Mowgli is taken and raised by a family of wolves. As the boy grows older, the wise panther Bagheera realizes he must be returned to his own kind in the nearby man-village. Baloo the bear however thinks differently taking the young Mowgli under his wing and teaching that living in the jungle is the best life there is. Bagheera realizes that Mowgli is in danger, particularly from Shere Khan the tiger who hates all people. When Baloo finally comes around, Mowgli runs off into the jungle where he survives a second encounter with Kaa the snake and finally, with Shere Khan. It's the sight of a pretty girl however that gets Mowgli to go the nearby man-village.                ",The Jungle Book
768,"Drama, Mystery, Romance","In late nineteenth century Vienna, renowned illusionist Eisenheim is reunited with the Duchess von Teschen when she is volunteered from the audience to participate in an illusion during one of his performances. Despite having not seen each other in fifteen years when they were teenagers, they almost immediately recognize each other as Eduard Abramovich and Sophie von Teschen, they who had a doomed romance at that time due to their class differences. The Duchess is soon to be wed to the Crown Prince Leopold in what would be for him a marriage solely in pursuit of power: overthrowing his father, the Emperor Leopold, as well as overtaking the Hungarian side of the empire. The Crown Prince is known to use violence against women if it suits his needs or purposes. As such, the Duchess, who realizes that she still loves Eisenheim and he her, can never leave the Crown Prince without it jeopardizing her life. After Eisenheim humiliates the Crown Prince at a private show which results in an ...                ",The Illusionist
769,Horror,"Dr. Markway, doing research to prove the existence of ghosts, investigates Hill House, a large, eerie mansion with a lurid history of violent death and insanity. With him are the skeptical young Luke, who stands to inherit the house, the mysterious and clairvoyant Theodora and the insecure Eleanor, whose psychic abilities make her feel somehow attuned to whatever spirits inhabit the old mansion. As time goes by it becomes obvious that they have gotten more than they bargained for as the ghostly presence in the house manifests itself in horrific and deadly ways.                ",The Haunting
770,"Action, Crime, Thriller","Martin Riggs is an L.A. cop with suicidal tendencies and Roger Murtaugh is the unlucky police officer with whom Riggs is assigned. Together they uncover a huge drug-smuggling operation, and as their success rate grows so does their friendship.                ",Lethal Weapon
771,"Drama, History, War","In 1937 China, during the second Sino-Japanese war, a mortician, John (<a href=""/name/nm0000288?ref_=tt_stry_pl"">Christian Bale</a>) arrives at a Catholic church in Nanjing to prepare a priest for burial. Upon arrival he finds himself the lone adult among a group of convent girl students and prostitutes from a nearby brothel. When he finds himself in the unwanted position of protector of both groups from the horrors of the invading Japanese army, he discovers the meaning of sacrifice and honor.                ",The Flowers of War
772,Thriller,"In honor of his late wife who died in a flaming car accident, scientist, Dr. Robert Ledgard, is trying to synthesize the perfect skin which can withstand burns, cuts or any other kind of damage. As he gets closer to perfecting this skin on his flawless patient, the scientific community starts growing skeptical and his past is revealed that shows how his patient is closely linked to tragic events he would like to forget.                ",The Skin I Live In
773,"Adventure, Biography, Drama","127 Hours is the true story of mountain climber Aron Ralston's remarkable adventure to save himself after a fallen boulder crashes on his arm and traps him in an isolated canyon in Utah. Over the next five days Ralston examines his life and survives the elements to finally discover he has the courage and the wherewithal to extricate himself by any means necessary, scale a 65 foot wall and hike over eight miles before he can be rescued. Throughout his journey, Ralston recalls friends, lovers, family, and the two hikers he met before his accident. Will they be the last two people he ever had the chance to meet?                ",127 Hours
